-- ///////////////////////////////////////// 

 
 

-- 1. Find the professor details and department details using NATURAL JOIN. 

SELECT prof_id, prof_fname, prof_lname, dept_id,dept_name, designation, salary, doj, email, phone, city 

FROM Professors 

NATURAL JOIN Departments; 

 

mysql> SELECT prof_id, prof_fname, prof_lname, dept_id,dept_name, designation, salary, doj, email, phone, city 

    ->     FROM Professors 

    ->     NATURAL JOIN Departments; 

+---------+------------+------------+---------+-----------+---------------------+--------+------------+---------------+------------+--------+ 

| prof_id | prof_fname | prof_lname | dept_id | dept_name | designation         | salary | doj        | email         | phone      | city   | 

+---------+------------+------------+---------+-----------+---------------------+--------+------------+---------------+------------+--------+ 

|       1 | Binod      | binod      |       1 | Computer  | Professor           |  25000 | 2015-01-01 | abc@gmail.com | 9149589875 | jammu  | 

|       4 | Rajwinder  | Singh      |       1 | Computer  | Professor           |  35000 | 2015-01-01 | stu@gmail.com | 9154659875 | mumbai | 

|       9 | Abhishek   | Dhar       |       1 | Computer  | Assistant Professor |  50000 | 1997-12-08 | zyx@gmail.com | 9164659875 | mumbai | 

|       2 | Sahil      | Singh      |       2 | IT        | Assistant Professor |  30000 | 2016-01-01 | xyz@gmail.com | 9149656875 | pune   | 

|       5 | Tejas      | Sarawade   |       2 | IT        | Professor           |  20000 | 2016-01-01 | jkl@gmail.com | 9144579875 | pune   | 

|       7 | Pradyumna  | Rajje      |       2 | IT        | Assistant Professor |   9000 | 2016-01-01 | vwx@gmail.com | 9197569875 | mumbai | 

|     101 | Danish     | Bhat       |       2 | IT        | Professor           |  15000 | 2015-01-01 | pqr@gmail.com | 9149654875 | pune   | 

|       3 | Sanchit    | Raina      |       3 | EnTC      | Professor           |  19000 | 2016-01-01 | def@gmail.com | 9149459875 | mumbai | 

|       6 | Sam        | Jagdale    |       3 | EnTC      | Assistant Professor |  40000 | 1999-12-26 | ghi@gmail.com | 9145759875 | pune   | 

|       8 | Ayush      | Raina      |       3 | EnTC      | Professor           |  18000 | 2015-01-01 | mno@gmail.com | 9145459875 | mumbai | 

+---------+------------+------------+---------+-----------+---------------------+--------+------------+---------------+------------+--------+ 

10 rows in set (0.00 sec) 

 

 

 
 

-- 2. Find the prof_id, prof_name and shift. (INNER JOIN) 

SELECT prof_id, prof_fname, prof_lname, shift 

FROM Professors 

INNER JOIN Shift 

using(prof_id); 

 

 

mysql> SELECT prof_id, prof_fname, prof_lname, shift 

    ->     FROM Professors 

    ->     INNER JOIN Shift 

    ->     using(prof_id); 

+---------+------------+------------+---------+ 

| prof_id | prof_fname | prof_lname | shift   | 

+---------+------------+------------+---------+ 

|       1 | Binod      | binod      | Morning | 

|       2 | Sahil      | Singh      | Evening | 

|       3 | Sanchit    | Raina      | Morning | 

|       4 | Rajwinder  | Singh      | Evening | 

|       5 | Tejas      | Sarawade   | Morning | 

|       6 | Sam        | Jagdale    | Evening | 

|       7 | Pradyumna  | Rajje      | Morning | 

|       8 | Ayush      | Raina      | Evening | 

|       9 | Abhishek   | Dhar       | Morning | 

|     101 | Danish     | Bhat       | Evening | 

+---------+------------+------------+---------+ 

10 rows in set (0.00 sec) 

 

 

 
 

-- 3. List all the department details and the corresponding names of professors in the same department.(left outer join)  

SELECT dept_id, dept_name, prof_fname,prof_lname 

FROM Departments 

LEFT JOIN Professors 

using (dept_id); 

 

mysql> SELECT dept_id, dept_name, prof_fname,prof_lname 

    ->     FROM Departments 

    ->     LEFT JOIN Professors 

    ->     using (dept_id); 

+---------+-----------+------------+------------+ 

| dept_id | dept_name | prof_fname | prof_lname | 

+---------+-----------+------------+------------+ 

|       1 | Computer  | Binod      | binod      | 

|       1 | Computer  | Rajwinder  | Singh      | 

|       1 | Computer  | Abhishek   | Dhar       | 

|       2 | IT        | Sahil      | Singh      | 

|       2 | IT        | Tejas      | Sarawade   | 

|       2 | IT        | Pradyumna  | Rajje      | 

|       2 | IT        | Danish     | Bhat       | 

|       3 | EnTC      | Sanchit    | Raina      | 

|       3 | EnTC      | Sam        | Jagdale    | 

|       3 | EnTC      | Ayush      | Raina      | 

+---------+-----------+------------+------------+ 

10 rows in set (0.00 sec) 

 

 

 

 
 

-- 4. List all the professors and the corresponding names of department.(right outer join)  

SELECT prof_fname, prof_lname, dept_name 

FROM Professors 

RIGHT JOIN Departments 

using (dept_id); 

 

 

mysql>     SELECT prof_fname, prof_lname, dept_name 

    ->     FROM Professors 

    ->     RIGHT JOIN Departments 

    ->     using (dept_id); 

+------------+------------+-----------+ 

| prof_fname | prof_lname | dept_name | 

+------------+------------+-----------+ 

| Binod      | binod      | Computer  | 

| Rajwinder  | Singh      | Computer  | 

| Abhishek   | Dhar       | Computer  | 

| Sahil      | Singh      | IT        | 

| Tejas      | Sarawade   | IT        | 

| Pradyumna  | Rajje      | IT        | 

| Danish     | Bhat       | IT        | 

| Sanchit    | Raina      | EnTC      | 

| Sam        | Jagdale    | EnTC      | 

| Ayush      | Raina      | EnTC      | 

+------------+------------+-----------+ 

10 rows in set (0.00 sec) 

 

 

 
 

-- 5. Display professor name, dept_name, shift, salary where prof_id = 101;(multitable join)  

SELECT p.prof_fname, p.prof_lname, d.dept_name, s.shift, p.salary 

from Professors p 

INNER JOIN Departments d ON d.dept_id = p.dept_id 

INNER JOIN Shift s ON s.prof_id = p.prof_id 

WHERE p.prof_id=101; 

 

mysql> SELECT p.prof_fname, p.prof_lname, d.dept_name, s.shift, p.salary 

    ->     from Professors p 

    ->     INNER JOIN Departments d ON d.dept_id = p.dept_id 

    ->     INNER JOIN Shift s ON s.prof_id = p.prof_id 

    ->     WHERE p.prof_id=101; 

+------------+------------+-----------+---------+--------+ 

| prof_fname | prof_lname | dept_name | shift   | salary | 

+------------+------------+-----------+---------+--------+ 

| Danish     | Bhat       | IT        | Evening |  15000 | 

+------------+------------+-----------+---------+--------+ 

1 row in set (0.00 sec) 

 

 

 

 
 

-- 6. list the total number of professor in each department.(count and any join,groupby) 

SELECT d.dept_name,count(*) as prof_count 

FROM Professors p 

INNER JOIN Departments d on p.dept_id = d.dept_id  

GROUP BY d.dept_name; 

 

 

 
mysql> SELECT d.dept_name,count(*) as prof_count 

    ->     FROM Professors p 

    ->     INNER JOIN Departments d on p.dept_id = d.dept_id  

    ->     GROUP BY d.dept_name; 

+-----------+------------+ 

| dept_name | prof_count | 

+-----------+------------+ 

| Computer  |          3 | 

| IT        |          4 | 

| EnTC      |          3 | 

+-----------+------------+ 

3 rows in set (0.00 sec) 

 

 

 

 

-- 7. List the prof_id associated department and the dept_name having name ‘computer’;(subquery)  

SELECT prof_id, dept_id, dept_name 

FROM Professors 

Where dept_id IN (SELECT dept_id FROM Departments WHERE dept_name='computer'); 

 

 

mysql> SELECT prof_id, dept_id 

    ->     FROM Professors 

    ->     Where dept_id IN (SELECT dept_id FROM Departments WHERE dept_name='computer'); 

+---------+---------+ 

| prof_id | dept_id | 

+---------+---------+ 

|       1 |       1 | 

|       4 |       1 | 

|       9 |       1 | 

+---------+---------+ 

3 rows in set (0.19 sec) 

 

 

 
 

 

-- 8. Find the names of all departments where the professors joined in year 2015 (or date of joining is 1-1-2015).(subquery)  

SELECT dept_name 

FROM Departments 

WHERE dept_id IN (SELECT dept_id FROM Professors WHERE doj='2015-01-01'); 

 

 

mysql> SELECT dept_name 

    ->     FROM Departments 

    ->     WHERE dept_id IN (SELECT dept_id FROM Professors WHERE doj='2015-01-01'); 

+-----------+ 

| dept_name | 

+-----------+ 

| Computer  | 

| IT        | 

| EnTC      | 

+-----------+ 

3 rows in set (0.08 sec) 

 

 

 

CREATE VIEW view_prof 

AS 

SELECT p.prof_id,p.prof_fname,p.prof_lname,p.dept_id,p.designation,p.salary,p.doj,p.email,p.phone,p.city,s.shift,s.working_hours 

FROM Professors p 

INNER JOIN Shift s 

ON p.prof_id = s.prof_id; 

 
 

--use view as-- 

SELECT * FROM view_prof; 

 

 

 

 

mysql> CREATE VIEW view_prof 

    ->     AS 

    ->     SELECT p.prof_id,p.prof_fname,p.prof_lname,p.dept_id,p.designation,p.salary,p.doj,p.email,p.phone,p.city 

    ->     FROM Professors p 

    ->     INNER JOIN Shift s 

    ->     ON p.prof_id = s.prof_id; 

Query OK, 0 rows affected (2.22 sec) 

  

mysql> SELECT * FROM view_prof; 

+---------+------------+------------+---------+---------------------+--------+------------+---------------+------------+--------+ 

| prof_id | prof_fname | prof_lname | dept_id | designation         | salary | doj        | email         | phone      | city   | 

+---------+------------+------------+---------+---------------------+--------+------------+---------------+------------+--------+ 

|       1 | Binod      | binod      |       1 | Professor           |  25000 | 2015-01-01 | abc@gmail.com | 9149589875 | jammu  | 

|       2 | Sahil      | Singh      |       2 | Assistant Professor |  30000 | 2016-01-01 | xyz@gmail.com | 9149656875 | pune   | 

|       3 | Sanchit    | Raina      |       3 | Professor           |  19000 | 2016-01-01 | def@gmail.com | 9149459875 | mumbai | 

|       4 | Rajwinder  | Singh      |       1 | Professor           |  35000 | 2015-01-01 | stu@gmail.com | 9154659875 | mumbai | 

|       5 | Tejas      | Sarawade   |       2 | Professor           |  20000 | 2016-01-01 | jkl@gmail.com | 9144579875 | pune   | 

|       6 | Sam        | Jagdale    |       3 | Assistant Professor |  40000 | 1999-12-26 | ghi@gmail.com | 9145759875 | pune   | 

|       7 | Pradyumna  | Rajje      |       2 | Assistant Professor |   9000 | 2016-01-01 | vwx@gmail.com | 9197569875 | mumbai | 

|       8 | Ayush      | Raina      |       3 | Professor           |  18000 | 2015-01-01 | mno@gmail.com | 9145459875 | mumbai | 

|       9 | Abhishek   | Dhar       |       1 | Assistant Professor |  50000 | 1997-12-08 | zyx@gmail.com | 9164659875 | mumbai | 

|     101 | Danish     | Bhat       |       2 | Professor           |  15000 | 2015-01-01 | pqr@gmail.com | 9149654875 | pune   | 

+---------+------------+------------+---------+---------------------+--------+------------+---------------+------------+--------+ 

10 rows in set (0.05 sec) 

 

 

 

 

-- 10. Perform Manipulation on simple view-Insert, update, delete, drop view. 

--CREATE SIMPLE VIEW 

CREATE VIEW view_dept 

AS 

SELECT dept_id,dept_name 

FROM Departments; 

-- Insert view. 

INSERT INTO view_dept 

VALUES( 

4, 'mechanical' 

); 

-- update view. 

UPDATE view_dept 

SET dept_name='Electrical' 

WHERE dept_id=4; 

 
 

-- drop view. 

DROP VIEW view_dept; 

 

 

mysql>  CREATE VIEW view_dept 

    ->         AS 

    ->         SELECT dept_id,dept_name 

    ->         FROM Departments; 

Query OK, 0 rows affected (0.18 sec) 

  

mysql> INSERT INTO view_dept 

    ->             VALUES( 

    ->                 4, 'mechanical' 

    ->             ); 

Query OK, 1 row affected (0.22 sec) 

mysql> select * from view_dept; 

+---------+------------+ 

| dept_id | dept_name  | 

+---------+------------+ 

|       1 | Computer   | 

|       2 | IT         | 

|       3 | EnTC       | 

|       4 | mechanical | 

+---------+------------+ 

4 rows in set (0.00 sec) 

  

mysql> UPDATE view_dept 

    ->             SET dept_name='Electrical' 

    ->             WEHRE dept_id=4; 

ERROR 1064 (42000): You have an error in your SQL syntax; check the manual that corresponds to your MySQL server version for the right syntax to use near 'WEHRE dept_id=4' at line 3 

mysql> UPDATE view_dept 

    ->             SET dept_name='Electrical' 

    ->             WHERE dept_id=4; 

Query OK, 1 row affected (0.26 sec) 

Rows matched: 1  Changed: 1  Warnings: 0 

  

mysql> select * from Departments; 

+---------+------------+ 

| dept_id | dept_name  | 

+---------+------------+ 

|       1 | Computer   | 

|       2 | IT         | 

|       3 | EnTC       | 

|       4 | Electrical | 

+---------+------------+ 

4 rows in set (0.00 sec) 

 

 
