mysql> CREATE DATABASE eight31155;
Query OK, 1 row affected (0.31 sec)

mysql> USE eight31155;
Database changed
mysql> CREATE TABLE Student
    -> (
    ->     Rollno int NOT NULL,
    ->     Name varchar(16) NOT NULL,
    ->     DateofAdmission DATE NOT NULL,
    ->     branch VARCHAR(16) NOT NULL,
    ->     percent DOUBLE NOT NULL,
    ->     Status varchar(16) NOT NULL,
    ->     PRIMARY KEY (Rollno)
    -> );
Query OK, 0 rows affected (0.67 sec)

mysql> CREATE TABLE Alumni
    -> (
    ->     Rollno int NOT NULL,
    ->     Name varchar(16) NOT NULL,
    ->     DateofAdmission DATE NOT NULL,
    ->     branch VARCHAR(16) NOT NULL,
    ->     percent DOUBLE NOT NULL,
    ->     Status varchar(16) NOT NULL,
    ->     PRIMARY KEY (Rollno)
    -> );
Query OK, 0 rows affected (0.69 sec)

mysql> INSERT INTO Student
    ->     (Rollno,Name,DateofAdmission,branch,percent,Status)
    -> VALUES
    ->     (1, 'Sanchit','1999-01-18','COMP',90.0,'c'),
    ->     (2, 'Ayush','2009-02-08','COMP',70.0,'c'),
    ->     (3, 'Abhishek','2019-12-19','COMP',80.1,'c'),
    ->     (4, 'Koushal','1997-02-14','COMP',91.4,'c'),
    ->     (5, 'Sourav','1996-10-14','IT',90.0,'c'),
    ->     (6, 'Ayush','1995-11-30','IT',92.5,'c'),
    ->     (7, 'Gourav','1993-09-24','IT',85.0,'c'),
    ->     (8, 'Sankit','1994-04-28','ENTC',87.2,'c'),
    ->     (9, 'Shivam','1992-03-18','ENTC',92.3,'c'),
    ->     (10, 'Sativa','2001-02-19','ENTC',91.4,'c');
Query OK, 10 rows affected (0.15 sec)
Records: 10  Duplicates: 0  Warnings: 0

mysql> CREATE TRIGGER T1 
    -> AFTER DELETE ON Student
    -> FOR EACH ROW
    -> INSERT INTO Alumni 
    -> VALUES
    -> (OLD.Rollno, OLD.Name,OLD.DateofAdmission,OLD.branch,OLD.percent,"alumni");
Query OK, 0 rows affected (0.24 sec)

mysql> CREATE TRIGGER T2
    -> AFTER UPDATE ON Student
    -> FOR EACH ROW
    -> INSERT INTO Alumni
    -> VALUES 
    -> (OLD.Rollno, OLD.Name,OLD.DateofAdmission,OLD.branch,OLD.percent,"alumni");
Query OK, 0 rows affected (0.21 sec)

mysql> select * from Student;
+--------+----------+-----------------+--------+---------+--------+
| Rollno | Name     | DateofAdmission | branch | percent | Status |
+--------+----------+-----------------+--------+---------+--------+
|      1 | Sanchit  | 1999-01-18      | COMP   |      90 | c      |
|      2 | Ayush    | 2009-02-08      | COMP   |      70 | c      |
|      3 | Abhishek | 2019-12-19      | COMP   |    80.1 | c      |
|      4 | Koushal  | 1997-02-14      | COMP   |    91.4 | c      |
|      5 | Sourav   | 1996-10-14      | IT     |      90 | c      |
|      6 | Ayush    | 1995-11-30      | IT     |    92.5 | c      |
|      7 | Gourav   | 1993-09-24      | IT     |      85 | c      |
|      8 | Sankit   | 1994-04-28      | ENTC   |    87.2 | c      |
|      9 | Shivam   | 1992-03-18      | ENTC   |    92.3 | c      |
|     10 | Sativa   | 2001-02-19      | ENTC   |    91.4 | c      |
+--------+----------+-----------------+--------+---------+--------+
10 rows in set (0.00 sec)

mysql> select * from Alumni;
Empty set (0.00 sec)

mysql> DELETE FROM Student where Name="Sanchit";
Query OK, 1 row affected (0.13 sec)

mysql> select * from Student;
+--------+----------+-----------------+--------+---------+--------+
| Rollno | Name     | DateofAdmission | branch | percent | Status |
+--------+----------+-----------------+--------+---------+--------+
|      2 | Ayush    | 2009-02-08      | COMP   |      70 | c      |
|      3 | Abhishek | 2019-12-19      | COMP   |    80.1 | c      |
|      4 | Koushal  | 1997-02-14      | COMP   |    91.4 | c      |
|      5 | Sourav   | 1996-10-14      | IT     |      90 | c      |
|      6 | Ayush    | 1995-11-30      | IT     |    92.5 | c      |
|      7 | Gourav   | 1993-09-24      | IT     |      85 | c      |
|      8 | Sankit   | 1994-04-28      | ENTC   |    87.2 | c      |
|      9 | Shivam   | 1992-03-18      | ENTC   |    92.3 | c      |
|     10 | Sativa   | 2001-02-19      | ENTC   |    91.4 | c      |
+--------+----------+-----------------+--------+---------+--------+
9 rows in set (0.00 sec)

mysql> select * from Alumni;
+--------+---------+-----------------+--------+---------+--------+
| Rollno | Name    | DateofAdmission | branch | percent | Status |
+--------+---------+-----------------+--------+---------+--------+
|      1 | Sanchit | 1999-01-18      | COMP   |      90 | alumni |
+--------+---------+-----------------+--------+---------+--------+
1 row in set (0.00 sec)

mysql> UPDATE Student 
    -> SET Name="Ayushi"
    -> where Name="Ayush";
Query OK, 2 rows affected (0.11 sec)
Rows matched: 2  Changed: 2  Warnings: 0

mysql> select * from Student;
+--------+----------+-----------------+--------+---------+--------+
| Rollno | Name     | DateofAdmission | branch | percent | Status |
+--------+----------+-----------------+--------+---------+--------+
|      2 | Ayushi   | 2009-02-08      | COMP   |      70 | c      |
|      3 | Abhishek | 2019-12-19      | COMP   |    80.1 | c      |
|      4 | Koushal  | 1997-02-14      | COMP   |    91.4 | c      |
|      5 | Sourav   | 1996-10-14      | IT     |      90 | c      |
|      6 | Ayushi   | 1995-11-30      | IT     |    92.5 | c      |
|      7 | Gourav   | 1993-09-24      | IT     |      85 | c      |
|      8 | Sankit   | 1994-04-28      | ENTC   |    87.2 | c      |
|      9 | Shivam   | 1992-03-18      | ENTC   |    92.3 | c      |
|     10 | Sativa   | 2001-02-19      | ENTC   |    91.4 | c      |
+--------+----------+-----------------+--------+---------+--------+
9 rows in set (0.00 sec)

mysql> select * from Alumni;
+--------+---------+-----------------+--------+---------+--------+
| Rollno | Name    | DateofAdmission | branch | percent | Status |
+--------+---------+-----------------+--------+---------+--------+
|      1 | Sanchit | 1999-01-18      | COMP   |      90 | alumni |
|      2 | Ayush   | 2009-02-08      | COMP   |      70 | alumni |
|      6 | Ayush   | 1995-11-30      | IT     |    92.5 | alumni |
+--------+---------+-----------------+--------+---------+--------+
3 rows in set (0.01 sec)
